{
  "schemaVersion": "1.0.0",
  "policyVersion": "s083-policy-1",
  "contentNodeId": "S083",
  "state": "UnpaidRemedyRequired",
  "permittedActions": [
    "RecordUnpaidRemedy"
  ],
  "criterionRevealAllowed": false,
  "paidProposalImprovementAllowed": false,
  "evidenceBearing": false,
  "masteryEffect": "NONE",
  "humanReviewRequired": false,
  "groundingResult": "NOT_APPLICABLE",
  "denialReason": "UnpaidRemedyRequired"
}
